{
  "decision": "NO_TRADE",
  "decision_timestamp": "2026-08-14T10:03:00-04:00",
  "evaluated_symbols": ["TEST"],
  "rejections": [{"symbol": "TEST", "reason": "No objective two-to-one target after extension.", "rejection_categories": ["EXTENSION", "INADEQUATE_REWARD_RISK"]}],
  "symbol": null,
  "current_price": null,
  "quote_timestamp": null,
  "catalyst": null,
  "catalyst_classification": null,
  "market_regime": null,
  "setup_type": null,
  "entry_trigger": null,
  "entry_trigger_type": null,
  "entry_condition": null,
  "entry_requires_qualitative_confirmation": null,
  "maximum_chase_price": null,
  "stop_price": null,
  "stop_basis": null,
  "target1": null,
  "target2_optional": null,
  "hypothetical_notional": null,
  "hypothetical_quantity": null,
  "planned_dollar_risk": null,
  "planned_account_risk_percent": null,
  "reward_risk_target1": null,
  "invalidation_condition": null,
  "pre_entry_invalidation_price": null,
  "pre_entry_invalidation_type": null,
  "time_exit": null,
  "latest_entry_time": null,
  "mandatory_flat_time": null,
  "confidence": null,
  "robinhood_tool_call_count": 10,
  "web_search_count": 2,
  "errors": []
}
