{
  "decision": "SHADOW_TRADE_PLAN",
  "decision_timestamp": "2026-08-14T10:03:00-04:00",
  "evaluated_symbols": ["TEST"],
  "rejections": [],
  "symbol": "TEST",
  "current_price": 9.95,
  "quote_timestamp": "2026-08-14T10:02:30-04:00",
  "catalyst": "Verified same-day company release.",
  "catalyst_classification": "VERIFIED_FRESH",
  "market_regime": "TRENDING_BULLISH",
  "setup_type": "COMPLETED_BASE_BREAKOUT",
  "entry_trigger": 10.0,
  "entry_trigger_type": "TRADE_AT_OR_ABOVE",
  "entry_condition": "Trade at 10.00; do not chase above the trigger.",
  "entry_requires_qualitative_confirmation": false,
  "maximum_chase_price": 10.0,
  "stop_price": 9.5,
  "stop_basis": "Below completed base low.",
  "target1": 11.0,
  "target2_optional": 11.5,
  "hypothetical_notional": 20.0,
  "hypothetical_quantity": 2.0,
  "planned_dollar_risk": 1.0,
  "planned_account_risk_percent": 1.0,
  "reward_risk_target1": 2.0,
  "invalidation_condition": "Trade at or below 9.50.",
  "pre_entry_invalidation_price": null,
  "pre_entry_invalidation_type": null,
  "time_exit": "2026-08-14T15:55:00-04:00",
  "latest_entry_time": "2026-08-14T15:40:00-04:00",
  "mandatory_flat_time": "2026-08-14T15:55:00-04:00",
  "confidence": 0.7,
  "robinhood_tool_call_count": 14,
  "web_search_count": 3,
  "errors": []
}
